<?xml version="1.0"?>
<xs:schema
    xmlns:xs="http://www.w3.org/2001/XMLSchema"
    targetNamespace="soa"
    xmlns="soa"
    elementFormDefault="qualified">
  <xs:element name="users">
    <xs:complexType>
      <xs:sequence maxOccurs="unbounded">
        <xs:element name="user">
          <xs:complexType>
            <xs:all>
              <xs:element name="name" type="xs:string"/>
              <xs:element name="gender" type="xs:string"/>
              <xs:element name="email" type="xs:string"/>
              <xs:element name="age" type="xs:int"/>
              <xs:element name="languages">
                <xs:complexType>
                  <xs:sequence maxOccurs="unbounded">
                    <xs:element name="language">
                      <xs:complexType>
                        <xs:all>
                          <xs:element name="name" type="xs:string"/>
                          <xs:element name="level" type="xs:string"/>
                        </xs:all>
                      </xs:complexType>
                    </xs:element>
                  </xs:sequence>
                </xs:complexType>
              </xs:element>
            </xs:all>
          </xs:complexType>
        </xs:element>
      </xs:sequence>
    </xs:complexType>
  </xs:element>
</xs:schema>